"Edit:The social media team was much more responsive and helpful. They sent me a new pair of earrings and finally rectified the situation after two years. If you have an issue with the quality of the item you bought, I suggest you reach out to their social media team instead.Save your money and do not shop here! Their customer service is TERRIBLE!!! I spent $1,800 on my first visit at Mejuri. One of the earrings I was sold was faulty - the clasp on the hoop earring kept coming undone while I was wearing it. As a result, one of the earrings fell down the drain. When I contacted customer service, they said there was nothing they could do about it since the earring was lost. This logic is flawed because had the earring not been lost DUE to it being faulty, then they would have replaced the earring? I will never shop here again and I would encourage everyone else to buy from a company that values their customers. Not worth the money.",North York,2.0,2/10/2024 0:00,Mejuri,4,"3401 Dufferin St, North York, ON, Canada",ON,Aleah Lewis,Failed,,
We had a great experience here today (and many times before in the past as well). The staff is super friendly and very helpful. We cant wait to come back. Thanks!,North York,0.0,9/10/2024 0:00,Mejuri,5,"3401 Dufferin St, North York, ON, Canada",ON,Layl,Failed,,
"I drove from London to this store today so that I could try on a list of rings I had. I am an active Mejuri customer and was willing to spend a considerable amount of money here, as this was a gift for my 10 year wedding anniversary. The store itself is truly beautiful, and the first person who helped us out was very friendly (the second person was not). However, only two of the 6 rings I had come to try were available to try on in the store. For one of the rings, the employee couldnt even find it, nor had heard of it. I pulled it up on the website to show her and she basically just said that it must be discontinued 🤷‍♀️ Now, this wouldnt have been too much of an issue if I hadnt tried all week leading up to this visit (almost 3 hrs drive) to call the store to check if they had the rings I wanted to try on. No one ever answered, and I also left a voicemail requesting a callback. I had a completely wasted trip to this store all because no one would answer the phone. 6 hours round trip I will never get back. If you live nearby, sure, go visit this store because its pretty. But if youre looking for the same or even similar selection that you get online, dont bother. And dont bother trying to call them either!",North York,1.0,2/10/2024 0:00,Mejuri,3,"3401 Dufferin St, North York, ON, Canada",ON,Christine Wilson,Failed,,
Stumbled upon this store out of sheer curiosity during my afternoon stroll. I was pleasantly surprised to be greeted with such love and enthusiasm. I cant wait to be back. This store will forever hold a special place in my heart.,North York,2.0,2/10/2023 0:00,Mejuri,5,"3401 Dufferin St, North York, ON, Canada",ON,Support Ntwrk,Failed,,
"Thank you to Kalli at the Yorkdale store for helping me place an order over the phone, but through on-line shopping! I dont totally trust on-line shopping having been scammed once before but this experience was top-notch!  Took just a few short minutes and I actually received  confirmation of my payment while still on the phone with Kalli! She was patient and waiting so all would go smooth for me and it did. Wow! Within the hour I was notified that it was being shipped.  Shipping was immediate and I received the Christmas gift for my daughter the verynext afternoon! Amazing service all around!",North York,1.0,2/10/2024 0:00,Mejuri,5,"3401 Dufferin St, North York, ON, Canada",ON,Betty Martens,Failed,,
"What a wonderful experience I had here! The stylists were immediately helpful, friendly, efficient, and kind! I went to see if they could repair my snapped chain, and they had it exchanged and sorted within minutes. Excellent customer service - thank you so much!",North York,1.0,2/10/2024 0:00,Mejuri,5,"3401 Dufferin St, North York, ON, Canada",ON,Hannah Mae Cruddas,Failed,,
"The Mejuri experience is amazing. From the minute you walk in there is a stylist to help you. They are all friendly and eager to help. They are patient and helpful. If you just want to browse, they let you do it. They are not pushy in any way. They are there to help you. If you buy something, they are happy that they could help you, if you dont buy anything, they are still cheerful and wish you well.",North York,2.0,2/10/2024 0:00,Mejuri,5,"3401 Dufferin St, North York, ON, Canada",ON,Rachel Gabler,Failed,,
"Went to their Yorkdale store to buy earrings as a Christmas gift.  The store was naturally busy during this time of the year.  What was disappointing is the place was fairly disorganized, there were no lineups, it felt like whoever is the loudest and who the sales member want to help is the deciding factor.  I was 1 of 2 men in the store and the sales team refused to make eye contact with me in order to get their attention to help.  I waited for about 20mins and they skipped me and started helping the ladies behind me.  Instead of making a scene since I know how short staff they are, I decided to leave and write this review.",North York,1.0,2/10/2024 0:00,Mejuri,2,"3401 Dufferin St, North York, ON, Canada",ON,Andy Parachutes,Failed,,
A huge thank you to Brittany at the Yorkdale store who demonstrated exceptional customer service.  Her patience and dedication to resolve our return/credit was much appreciated. Mejuri has stunning jewelry and their team strives to give the best customer experience,North York,0.0,2/10/2024 0:00,Mejuri,5,"3401 Dufferin St, North York, ON, Canada",ON,Eddie L,Failed,,
"Found the staff to be super unfriendly. Woman at the door didnt say anything other than ""you can go in now"" & I asked for help with a bracelet and was told it only comes in 1 size despite having the same bracelet pulled up in front of me with 3 sizes available. Regardless of whether the store was out of stock in other sizes, or she simply didnt want to assist me, her demeanour was off putting and influenced my decision not to purchase anything.",North York,4.0,2/10/2024 0:00,Mejuri,1,"3401 Dufferin St, North York, ON, Canada",ON,Beatrix W,Failed,,
"I came to this location to pick-up an order that I placed online. I was nicely greeted by staff as I walked in and Grace kindly assisted me with the pick-up process. In minutes my order came out nicely packaged.I also unexpectedly inquired about a product that I purchased last fall (October 2022) on the website (and picked up in store at the Dundas location), as there was a defect on a pair of earrings. Grace reviewed the earrings with me and informed me of the 2 year warranty that would cover my case, and they were replaced on the spot. Completely did not expect a full replacement on the spot, and only thought it would be a different process for days or weeks to be resolved. Safe to say, Grace was kind and informative during my visit and I would not hesitate to shop at this location again. Thank you Grace!! :)",North York,3.0,2/10/2024 0:00,Mejuri,5,"3401 Dufferin St, North York, ON, Canada",ON,Theraiza,Failed,,
"A bracelet I bought 6 months ago had a faulty clasp. I walked into the store, showed it to the sales associate and within 5 min walked out with a new bracelet. I didnt have to find my receipt, he found it for me based on my email. All with a smile!",North York,0.0,6/10/2024 0:00,Mejuri,5,"3401 Dufferin St, North York, ON, Canada",ON,Dagmara Fijalkowski,Failed,,
Deeply disappointed in your company. Firstly my earrings broke 3 times and the last time I had to change them to a cheaper one with a more reliable clip. Then I decided to use credit and ordered another earrings and paid for fast shipping. When I was ordering the system showed that the shipping takes 1-3 business days which I counted should be enough to deliver it before I leave the country. Once I placed the order system showed me that  there will be also a processing time and my order will be probably delivered 2-3 days later than it was shown before. Your customer support was useless to help solve this.Awful experience!,North York,0.0,2/10/2024 0:00,Mejuri,1,"3401 Dufferin St, North York, ON, Canada",ON,Iana Arkhipova,Failed,,
"I love everything about Mejuri! Mejuri has impressed me with its quality Mejuris designs are trendy, elegant. Always get compliments on my earring, rings,necklaces.Customer Service at the store was brilliant. CorneliaToronto, Yorkdale mall) helped me many times. She very knowledgeable about every piece. No problem with return or exchange,she was so helpful.Fantastic  product and Customer service!",North York,0.0,3/10/2024 0:00,Mejuri,5,"3401 Dufferin St, North York, ON, Canada",ON,Nataliya Sun,Failed,,
I came in looking for rings and had a fantastic service with Cornelia! She went above and beyond in helping me decide on a ring. Extremely sweet and kind! Thanks again.,North York,0.0,7/10/2024 0:00,Mejuri,5,"3401 Dufferin St, North York, ON, Canada",ON,Iman R P,Failed,,
"Went to this location for the first time today. Its a great spacious store for all their amazing pieces. I was disappointed to hear they discontinued the bracelet I was looking for but happily changed my browsing direction to their rings. I am continuously building my ring stack/collection and Britney provided an amazing in store experience while looking to do so. She was genuine, kind, and patient (felt zero pressure to buy anything immediately, she acknowledged that it takes time to build a stack) & had great suggestions that made perfect sense when it came to styling certain pieces with others. Something else that didnt go unnoticed was that she took the time to greet & notice every customer that walked in while still focused on helping me browse. I ended up purchasing a ring I love & is an essential to my current stack. Unfortunately I didnt get to say thank you before I purchased & left so I thought I would write this review - Thank you Britney!",North York,1.0,2/10/2024 0:00,Mejuri,5,"3401 Dufferin St, North York, ON, Canada",ON,Morgan Demeau,Failed,,
"Awesome customer service, beautiful store and jewelry! I had a little issue with my earring clasp and they replaced it without question! I love how they all work as a team like a well-organized assembly line.",North York,1.0,2/10/2024 0:00,Mejuri,5,"3401 Dufferin St, North York, ON, Canada",ON,Mel Copeland,Failed,,
Great service. The sales person remembered me and was very helpful. Glad I went to Mejuri again.,North York,0.0,9/10/2024 0:00,Mejuri,5,"3401 Dufferin St, North York, ON, Canada",ON,Sharon S,Failed,,
"Very bad customer service at the Yorkdale location. I had a mens silver square box bracelet which has now broken 3 separate times and have had to exchange it for a new one each on each these occasions due to the clasp breaking after a few months of usage. This is understandable, however trying to exchange it this time was a bad experience as the manager of the location (wasnt able to get her name but the brunette manager) was rude and snippy, and refused to exchange it for another product that was only $20 more.",North York,1.0,2/10/2024 0:00,Mejuri,2,"3401 Dufferin St, North York, ON, Canada",ON,Jonah Ernest,Failed,,
"Have visited the store twice, on two different occasions. On both occasions no one was very welcoming at all. The first time was ok, the manager at the front concierge it seems like was very nice and sociable! The second time I came when it wasnt quite busy, as there was no line like there usually is. Everyone seems pretty done with their lives and didnt really pay me any mind. The associate I dealt with did the absolute bare minimum to look for a size for me and help me with my request. She made me feel a bit uncomfortable and I felt a bit pressured into buying the product. She even handed me the phone to do her job which is asking me basic details that were already in the system. I got what I wanted but since I know my size I would just go online from now on, with the retail front not being very helpful and a bit cold. For such a brand that is all about diversity and positivity, there was a great lack of it on the retail front. I hope they improve their overall customer service experience in the future! :)EDIT:The jewelry tarnishes so fast! I bought a pair of sterling silver earrings and didnt put them away ""properly"", which is just sitting in a drawer, and they tarnished so badly! What a waste of my money. Pretty disappointed with the quality of these cheap pieces. Dont waste your coins and spend them for real quality jewelry elsewhere! Youve been warned! :)",North York,8.0,2/10/2024 0:00,Mejuri,1,"3401 Dufferin St, North York, ON, Canada",ON,ZyZy S,Failed,,
Beautiful pieces and excellent customer service.  I was helped right away and had 1 on 1 attention and he didnt leave until i asked all of my questions and tried on a bunch of items.  He even helped me with other options and gave his personal opinion when asked.  It was like having a best friend shopping with me.  Great experience and highly recommend.,North York,0.0,2/10/2024 0:00,Mejuri,5,"3401 Dufferin St, North York, ON, Canada",ON,Danielle Zale,Failed,,
"Amazing service at that Yorkdale location. I think the representatives name was Trion. Came to exchange a couple items that were gifted to me and I also asked about a currently necklace that I own as the clasp part was tangled in a knot. I asked how I could get it untangled, she took it to the back and came back and informed me she could replace the necklace on the spot. Such amazing service for the exchange of new purchases and after care!",North York,1.0,2/10/2024 0:00,Mejuri,5,"3401 Dufferin St, North York, ON, Canada",ON,Susanna Mark,Failed,,
"Came here on the weekend to exchange pearl earrings I bought online. There was a line up outside but I was pleasantly surprised how fast it moved. I was helped out by Megan (I hope I have her name spelled right) and she was such a dream to work with. She made my exchange so smooth and asked my opinion on another pair for me to look at for the exchange. Instead of ending the transaction right after, she asked about my experience overall and I really appreciated that as it was so thoughtful and personable. Thank you Megan for making my visit such a wonderful one.",North York,1.0,2/10/2023 0:00,Mejuri,5,"3401 Dufferin St, North York, ON, Canada",ON,Salma Khan,Failed,,
"Went to buy a birthday gift for a friend and the staff helped us decide the perfect choice out of the options we were interested in. The jewelry we purchased was a bit difficult to find but Mejuri made sure we were as comfortable as possible during the wait with seating and refreshments, as well as generously providing a special add on to apologize for the unexpected wait time. Our friend absolutely loved her birthday gift. If you are ever at the Yorkdale location look for the manager Chris and hell make sure you are well taken care of.",North York,0.0,2/10/2023 0:00,Mejuri,5,"3401 Dufferin St, North York, ON, Canada",ON,Tyler Cobbinah,Failed,,
"TERRIBLE customer service. Just order online if you must. The girls that work here should all be fired and replaced, every time Ive come into the store, weve been in great moods, but the girls there create such a miserable experience that we end up leaving in horrible moods. We were helped by a Persian female at around 8pm tonight.",North York,3.0,2/10/2024 0:00,Mejuri,1,"3401 Dufferin St, North York, ON, Canada",ON,dougamanda,Failed,,
"Not a great buying experience, felt kinda isolated in the store- maybe because Im a man and the store caters mostly to women and couples. I was looking at some mens jewelry and the person helping did not even crack a smile and gave very little information about the design and if there were any other similar options. Aside from the final associate handing me the necklace, the other people working there didnt even acknowledge me or make eye contact, while they kept welcoming and saying goodbye to other guests enthusiastically.When I went back to talk to the initial associate behind the counter to compare the necklace I bought, I was ignored while she helped 2 couples that came after me, until I interjected and said I would like some help. After waiting about 15mins, I finally got some help. Overall, a very isolating and negative buying experience in-person, Id probably just stick to the website and have it shipped. Horrible, horrible customer service experience, and it makes sense that they are mostly an online retailer.",North York,8.0,2/10/2023 0:00,Mejuri,1,"3401 Dufferin St, North York, ON, Canada",ON,Amil De Silva,Failed,,
"Delighted to see the store inside yorkdale. Ive seen so much advertisement and wanted to see what they had to offer. Immediately felt uncomfortable as EVERY SINGLE sales associate, supervisor, keyholder or manager if they had any on their phone. I mean I did a walk around to see what products were displayed, my mother wanted to try one of the piece. I felt repelled to ask anyone to see if we could try them on. I walked up to them and asked anyways. The lady looked up and said Everything is sanitized after each use, so just try (But there were other customers who were trying and putting the items back where it was found without being cleaned..?) than proceeded to do whatever she was doing on her phone. We walked out. I guess it was just all hype? I wouldnt recommend. Save your time and go to real brands like Cartier. Save up and get the real deal.",North York,1.0,2/10/2024 0:00,Mejuri,1,"3401 Dufferin St, North York, ON, Canada",ON,Alexis K,Failed,,
Store is empty but they are creating a fake line up 🤷🏽‍♂️ who do you think you guys are Dior?,North York,0.0,12/10/2024 0:00,Mejuri,1,"3401 Dufferin St, North York, ON, Canada",ON,Marasinghe Marasinghe,Failed,,
"I will actually never go back to this store, the associate I had yesterday evening was so rude and made my experience confusing. When I asked her questions she would ignore them and did the absolute bare minimum to help me complete my exchange. I was also told the wrong information and found out I couldve just shopped online which wouldve been more pleasant. I left more confused than when I came in and ended up regretting what I got. Although some of the workers were nice, the ones on the floor shouldnt be in customer service.",North York,5.0,2/10/2023 0:00,Mejuri,1,"3401 Dufferin St, North York, ON, Canada",ON,caroline vadász,Failed,,
Mejuri is such an amazing place. I went to shop at the Yorkdale location! I bought my sisters ring and my friends gifts from there!! I also ordered myself a ring! Definitely recommend going to this place as its not only the best but very affordable and astonishing selections to choose from!,North York,1.0,2/10/2024 0:00,Mejuri,5,"3401 Dufferin St, North York, ON, Canada",ON,daniella bonilla,Failed,,
"I had an excellent experience at this Mejuri location. Connor provided exceptional assistance as my fiance and I tried on wedding bands. Connor was incredibly knowledgeable, accommodating, and made the whole experience enjoyable!",North York,0.0,3/10/2024 0:00,Mejuri,5,"3401 Dufferin St, North York, ON, Canada",ON,Stephanie S,Failed,,
"The quality of their jewellery is garbage and their customer service is even worse. more..Bought small bracelet from their store and it broke within a month. Went back to get it fixed and they wont fix it unless I show them a receipt. Who keeps around a receipt for everything they purchased. I wanted to show them proof of purchase from my bank account, but they dont want to honour the warranty.Dont buy from here, its low quality and overpriced.",North York,5.0,2/10/2024 0:00,Mejuri,1,"3401 Dufferin St, North York, ON, Canada",ON,Anirban D,Failed,,
I bought a great pair of earrings this morning at the Yorkdale location.  I was there early am so I had all the help that I needed.My stylist was very informative and I trusted her opinion.,North York,1.0,2/10/2024 0:00,Mejuri,5,"3401 Dufferin St, North York, ON, Canada",ON,Barbara Thompson,Failed,,
"Edit:Their team reached out over email and made great effort to invite me back and fix the situation. Changing to 3 stars.New to the Mejuri brand and I love a lot of the mens jewelry designs. But hoping corporate sees this review so the company can improve its customer service experience from online to in store:Whats the point of having your customers book an online styling appointment, fill in information on the specifics they need help with and the specific items they want to see, then to show up at your appointment and the staff in store have no information about anything you wrote down?It kinda kills the point of even having an online appointment system. When it comes to luxury goods like jewelry, the experience of purchasing the item is just as important as the item itself.I came in on time for my appointment expecting to see a few specific items (and wanted to buy them if they looked just as good IRL as online). Then I ended up waiting 20-30 minutes while the employee went back and forth to the back of the store telling me ""oh we cant find this, we cant find that. I can only bring you one item a time,"" then proceed to not talk to me at all while Im trying things on when she finally ends up finding the items (back room need better organization?). I ended up leaving before I even saw all the items I wanted cuz it was comical how bad the customer service experience was lol.Maybe the employees dont get commission so they dont care as much. Im not expecting a Chanel or Van Cleef level of customer service, but at least something on par with Apples organizational system where info is actually passed along would be great.",North York,3.0,2/10/2024 0:00,Mejuri,3,"3401 Dufferin St, North York, ON, Canada",ON,Rob Woe,Failed,,
My boyfriend and I went to Yorkdale mall  to look for a gift for my birthday  it was yesterday June 18th.As we walk around we came across at the MEJURI store we saw a line up and wanted to check it out.My boyfriend liked these pair of Pavé Diamond Bold Huggie Hoops and he purchased them for me.I wore it at work today to show everyone I almost lost one because the clasp was defective.Furious  beyond words.I tried to call them today left several messages no one returned my calls.Got a hold of the live chat who tells me to ship the earrings back so I could get a new pair shipped to me.Terrible customer service and the company has not standard or customer service.I was better off going into Tiffany and be satisfied than upset.Wont visit this store ever again…..😝I wont recommend you will be very upset go elsewhere and invest your money in better quality.Should have checked the reviews no wonder why the rating is so low 👎.,North York,1.0,2/10/2024 0:00,Mejuri,1,"3401 Dufferin St, North York, ON, Canada",ON,Filu S,Failed,,
"I had a terrible experience at this store today. My wife and I went in around 7 pm and purchased 2 bracelets as a gift, but the sales associate made a mistake and scanned the wrong one, which I didnt notice until I received my order. Mistakes happens, but I was disappointed when I pointed out the error to the manager of the store, who looked irritated (Id assume that she was the manager because shes the only wearing a black top as opposed the the sales associate who took my order who wears white). The customer service was extremely poor. To make matters worse, I had to go back to the store after leaving because they didnt include a gift receipt, which I had specifically requested during my purchase. Overall, I would not recommend this store to anyone due to the poor service and lack of attention to detail.",North York,5.0,2/10/2023 0:00,Mejuri,1,"3401 Dufferin St, North York, ON, Canada",ON,Christian Janell Tapic,Failed,,
"This past holiday season I was on the hunt for something special to surprise my partner for our anniversary and I am very thankful for coming in to the shop. I was greated kindly by an employee named Chris who went out of his way to help me find the perfect piece! He asked me about what I had in mind, provided me with multiple great options for gifts, and showed me a great deal of respect and patience! My partner has been wearing her new neckless a ton and is absolutely loving it to this day! It was a wonderful time spent and I am sure to be back again!",North York,0.0,2/10/2024 0:00,Mejuri,5,"3401 Dufferin St, North York, ON, Canada",ON,Jesse Moniz,Failed,,
"The staff at this location is amazing! So kind, so friendly, so nice. You really have to experience it for yourself. It truly was the best shopping experience I have ever experienced. Bravo Mejuri Yorkdale staff.",North York,1.0,2/10/2024 0:00,Mejuri,5,"3401 Dufferin St, North York, ON, Canada",ON,Fusion Rico,Failed,,
