"This place is my go-to for high quality jewelry, I literally dont shop anywhere else! Theyre always super helpful if any items need replaced under warranty and the service is always incredible!",San Diego,0.0,8/10/2024 0:00,Mejuri,5,"4545 La Jolla Village Dr Suite C-12, San Diego, CA",CA,Hannah Ashley,Failed,,
Kelly was great with everything. She helped me choose jewelry and went into a lot of detail to make sure My piercings would heal properly! I def recommend coming here for a piercing.,San Diego,1.0,2/10/2024 0:00,Mejuri,5,"4545 La Jolla Village Dr Suite C-12, San Diego, CA",CA,Mariam Altamimi,Failed,,
"I would hang out in this store all day long if I could! Kelly is a piercing queen. She did my cartilage and I had NO idea she even pierced it (thats how amazing she is). I was speechless! And I want Taylor to be my new best friend. 10,000/10. Ill be back in next week to get some more piercings for sure!",San Diego,1.0,2/10/2024 0:00,Mejuri,5,"4545 La Jolla Village Dr Suite C-12, San Diego, CA",CA,Sydney Campbell,Failed,,
Kira was my piercer today and she did an amazing job both as a piercer and as a support system! I expressed that I was nervous and she was extremely sweet and made me feel safe throughout the entire process. Thank you!,San Diego,1.0,2/10/2024 0:00,Mejuri,5,"4545 La Jolla Village Dr Suite C-12, San Diego, CA",CA,Maddie Keefe,Failed,,
Took a quick visit to San Diego and happened to pop in the Mejuri store. It was such a cool concept. I got a piercing by Kelly and she was the best! She was super knowledgeable and clean. Check them out!,San Diego,1.0,2/10/2024 0:00,Mejuri,5,"4545 La Jolla Village Dr Suite C-12, San Diego, CA",CA,Jessica Davis,Failed,,
Kyra was absolutely AMAZING!!! She changed out my cartilage piercing and was so patient during the whole process. It was quick and painless. She has hands of an angel.,San Diego,2.0,2/10/2024 0:00,Mejuri,5,"4545 La Jolla Village Dr Suite C-12, San Diego, CA",CA,Miranda Garcia,Failed,,
Stopped by on a whim and found a beautiful pair of earrings that I loved! Its so nice that you can try them on and the sales people are very helpful without being pushy. I will come back again!,San Diego,1.0,2/10/2024 0:00,Mejuri,5,"4545 La Jolla Village Dr Suite C-12, San Diego, CA",CA,Sarah DuFresne,Failed,,
"Rachel and Kelly are so helpful and kind, my sister and I wanted to get piercings WITH good jewelry and they both helped me find jewelry for my sister and I, and pierced us. Definitely coming in again to get another piercing ASAP…",San Diego,1.0,2/10/2024 0:00,Mejuri,5,"4545 La Jolla Village Dr Suite C-12, San Diego, CA",CA,Jackson Bogdan,Failed,,
"Recently went into Mejuri and had a really great experience. I was helped by Haley, she was very nice, easy to talk to and extremely patient with me! I will absolutely be back for more accessories!",San Diego,2.0,2/10/2023 0:00,Mejuri,5,"4545 La Jolla Village Dr Suite C-12, San Diego, CA",CA,Emily Keith,Failed,,
"Havent even went yet but Kelly is the best person alive, Kelly is wonderful and I dont know what I would do without her. A little concerned about Rhodora Manglinongs review on racism but a bit more concerned she gave the racist interaction a 4 star review cant wait to meet Kelly",San Diego,0.0,2/10/2024 0:00,Mejuri,5,"4545 La Jolla Village Dr Suite C-12, San Diego, CA",CA,STG Pickles,Failed,,
"Kelly was the BEST piercer Ive ever had. Shes so kind, welcoming, and funny which is always a plus. Loved her!",San Diego,1.0,2/10/2024 0:00,Mejuri,5,"4545 La Jolla Village Dr Suite C-12, San Diego, CA",CA,Madeline Tastor,Failed,,
I was helped by Natalie. She was so sweet and patient. She helped with an exchange and made me feel so comfortable. This store was the total opposite of the Melrose location where I felt ignored and out of place.,San Diego,1.0,2/10/2024 0:00,Mejuri,5,"4545 La Jolla Village Dr Suite C-12, San Diego, CA",CA,Irene Rodriguez,Failed,,
"Made a styling appt for 10:30am, received multiple reminders from THEIR system and they werent open, and were unable to honor the styling appt. Really disappointed in the customer service. Was gonna tell my friends about this place because they were curious. Wont bother now.",San Diego,1.0,2/10/2024 0:00,Mejuri,1,"4545 La Jolla Village Dr Suite C-12, San Diego, CA",CA,Sara Spiva,Failed,,
"Kelly pierced my ear. Kelly is great. I love Kelly, Im giving her my firstborn. No jk, lol.. but seriously shes great!",San Diego,1.0,2/10/2024 0:00,Mejuri,5,"4545 La Jolla Village Dr Suite C-12, San Diego, CA",CA,gali gonzalez,Failed,,
"June 9, 2023 Between 3-4 pm. UTC Mejuri San Diego California. Racism occurred. Manager/Assistant Mgr treated customers in unacceptable way, not realizing damaging Mejuris image. Hope these employees get Proper CUSTOMER SERVICE Training.",San Diego,1.0,2/10/2024 0:00,Mejuri,4,"4545 La Jolla Village Dr Suite C-12, San Diego, CA",CA,Rhodora Manglinong,Failed,,
Ive gotten pierced a few times here and I absolutely love it! Kelly is amazing!,San Diego,0.0,2/10/2024 0:00,Mejuri,5,"4545 La Jolla Village Dr Suite C-12, San Diego, CA",CA,Francis Evangelista,Failed,,
Super dainty and cute and really good quality ..Rachel was great! Super helpful with all our questions..will definitely buy more!,San Diego,0.0,2/10/2024 0:00,Mejuri,5,"4545 La Jolla Village Dr Suite C-12, San Diego, CA",CA,Ria Olaes,Failed,,
Great sales associates and store is straight forward. I have an amazing experience every time I go in,San Diego,0.0,3/10/2024 0:00,Mejuri,5,"4545 La Jolla Village Dr Suite C-12, San Diego, CA",CA,Sam Liew,Failed,,
The best girlies work in there and so sweet and welcoming! Thank you Melissa!,San Diego,0.0,4/10/2024 0:00,Mejuri,5,"4545 La Jolla Village Dr Suite C-12, San Diego, CA",CA,Julie Grisett,Failed,,
Bethany was the best 😏She helped me look my best without even finding what I was looking for.God bless Mejuri 🫶🏻,San Diego,2.0,2/10/2024 0:00,Mejuri,5,"4545 La Jolla Village Dr Suite C-12, San Diego, CA",CA,Israel Mena,Failed,,
My favorite jewelry shop! Once you go here you will be hooked!,San Diego,0.0,2/10/2024 0:00,Mejuri,5,"4545 La Jolla Village Dr Suite C-12, San Diego, CA",CA,Marycruz Martinez,Failed,,
The store has very friendly staff that know their products.,San Diego,0.0,2/10/2024 0:00,Mejuri,5,"4545 La Jolla Village Dr Suite C-12, San Diego, CA",CA,Bernie Camberos,Failed,,
Kelly was amazing! So helpful!,San Diego,0.0,2/10/2024 0:00,Mejuri,5,"4545 La Jolla Village Dr Suite C-12, San Diego, CA",CA,Hannah Ghassemian,Failed,,
The best!!,San Diego,0.0,6/10/2024 0:00,Mejuri,5,"4545 La Jolla Village Dr Suite C-12, San Diego, CA",CA,syc90,Failed,,
"This company is completely fraudulent. When sending in warranty claims theyre getting rejected, even though all of the jewelry has been sent back to the company. The jewelry is falling apart and tarnishing even when it stated that its real metal. No one from the warranty department is getting back to me and these practices are completely untrustworthy.  They have taken back the product without providing a reimbursement or replacement product.   Heres some photos of how the jewelry looked after wearing for a short time.  I sent back almost $500 worth and havent received anything in return.",Seattle,1.0,10/10/2024 0:00,Mejuri,1,"2621 NE University Village St, Seattle, WA",WA,Sunny,Failed,,
I went in for a piercing checkup and was so lucky to have Daisha take care of me. Her presence instantly put me at ease and the whole experience was so quick and painless. Daisha has many beautiful piercings so she was able to answer all of my questions and make sure I had the information needed to take care of my piercing. Cant recommend her enough!,Seattle,0.0,1/10/2025 0:00,Mejuri,5,"2621 NE University Village St, Seattle, WA",WA,Malgosia Kostecka,Failed,,
"Got a few piercings here and it was such a fabulous experience! When scheduling, I ran into a couple hiccups and Daisha worked around it all and made it happen exactly as I had hoped! When I came in for the appointment, she was so kind, professional, had a presence that made me feel comfortable, and I was extremely impressed with how quick she made it! I would absolutely get pierced by Daisha in the future! Shes amazing!!!!",Seattle,0.0,1/10/2025 0:00,Mejuri,5,"2621 NE University Village St, Seattle, WA",WA,Sarah Hudson,Failed,,
"I went to this shop to try on all of the wedding band options and Megan was an amazing help! She was patient and fun to talk with as I tried on a bunch of different options and even went to the back to find rings in my exact size so I could get a better idea of how they looked with my engagement ring. Ive heard this shop gets busy at peak hours, so I went at lunchtime on a Monday instead and was helped immediately.",Seattle,0.0,8/10/2024 0:00,Mejuri,5,"2621 NE University Village St, Seattle, WA",WA,Leah Johnson,Failed,,
Spent a pretty penny here. Three days after purchasing there was black tarnish leftover on my fingers from where the Mejuri rings were sitting. I was shocked and disappointed. Dont waste your money!,Seattle,0.0,1/20/2025 0:00,Mejuri,1,"2621 NE University Village St, Seattle, WA",WA,Vanesa Rusa,Failed,,
"Not only is it overpriced for what you get, they straight up lie to you. I did not want to provide my email but was told it was the only way to get a receipt. The rep swore up and down I wouldnt get any marketing emails and then what do you know? I did.Its a dumb, overpriced hipster store with no price transparency. You are better served elsewhere.",Seattle,0.0,12/10/2024 0:00,Mejuri,2,"2621 NE University Village St, Seattle, WA",WA,JD RL,Failed,,
"Im not one to leave bad reviews, unless I continue experiencing issues at a store I frequent. To be clear, I love Mejuri jewelry and have been a customer since before they had physical stores in Seattle. The issue here seems to be within customer service. Whenever I walk into this store, I always feel like their last priority. They greet everyone else and people who come in after me, and it seems like they avoid asking if I need help. I dont understand it. I worked at Nordstrom in fine jewelry and watches for over 5 years and give a lot of grace because I know that things can get chaotic. Considering the size of this store and the demand for product, it makes sense why they are always busy. This time I tried to make eye contact with one of the associates and they looked at me and then looked away, and greeted another customer that came into the store. I had errands to run so I didnt have makeup on nor did I have a ton of jewelry on, which is not usual for me. I dont want to make extreme assumptions so Ill let management take it from here. Just disappointing.",Seattle,0.0,6/10/2024 0:00,Mejuri,2,"2621 NE University Village St, Seattle, WA",WA,Renee D,Failed,,
"Ive been a Mejuri customer for years, but exclusively online! I was stoked to see a physical location. The staff was incredible, they helped me find all the pieces Ive been looking at online. And you get to try them on in store!! There were a few sets of earrings Ive wanted to purchase, and trying them on in store helped me make my final decision. I had a wonderful experience and will absolutely be back whenever Im in the Seattle area.",Seattle,0.0,4/10/2024 0:00,Mejuri,5,"2621 NE University Village St, Seattle, WA",WA,Keng Griffitts,Failed,,
"I didnt feel welcomed during my visit to the store. Despite there being around 5 staff members present, they seemed preoccupied with chatting amongst themselves. This made it uncomfortable for me to inquire about prices for items I was interested in. As a result, I left without making any purchases. I will continue purchase online as the in store experience was horrible.",Seattle,1.0,7/10/2024 0:00,Mejuri,1,"2621 NE University Village St, Seattle, WA",WA,Emma Yu,Failed,,
Liv was so helpful.  I came in for a post-downsize and she guided me to a good choice that was appropriate for my tragus piercing that still had a bit of swelling. She was patient and very professional.,Seattle,0.0,7/10/2024 0:00,Mejuri,5,"2621 NE University Village St, Seattle, WA",WA,Jennifer Dyrland,Failed,,
"I shopped for a gift for a friend.  The necklace I purchased was more than I initially wanted to pay, but when I understood the quality of the gold/knowing you can always keep the necklace on, I decided to go for it.Im confident about my purchase because of the sales person that helped me and explained everything.",Seattle,1.0,3/10/2024 0:00,Mejuri,5,"2621 NE University Village St, Seattle, WA",WA,joy barton,Failed,,
"Have shopped at Mejuri U Village before & enjoyed the experience, so I used them for new piercings I wanted and was extremely happy with the experience. I arrived early & they started me early. Their piercer, Shelby, was wonderful, informative, helpful. 10/10 would get pierced here again.",Seattle,1.0,3/10/2024 0:00,Mejuri,5,"2621 NE University Village St, Seattle, WA",WA,Roberta Frazier,Failed,,
"I went to their piercing studio and it was so amazing. Their piercer, Shelby, was so kind and patient. She really took her time to explain things and give her professional advise while also listening to what the client wants.",Seattle,0.0,3/10/2024 0:00,Mejuri,5,"2621 NE University Village St, Seattle, WA",WA,Sophia Torres (phia1225),Failed,,
"We got their 4mm Titanium satin finish ring as a wedding band for myself (male). I liked their simple designs and for a reasonable price.The staff was really helpful with my selection, however, I was kind of between two ring sizes. After going with the smaller one for a day, it was feeling quite uncomfortable, so I brought it back and was able to exchange it without issue for the larger one (as the ring was still in great condition). Really appreciated the help with making the process easy!",Seattle,1.0,2/10/2024 0:00,Mejuri,5,"2621 NE University Village St, Seattle, WA",WA,Anson Lin,Failed,,
"Great customer service & a very nice experience shopping at the University Village Mejuri store. I spent more time making decisions than the typical person as i had my eye on several items.  The stylists were friendly & helpful, and nonjudgemental, which i appreciate.The jewelry styles are beautiful & im very happy with my purchases.  Will definite shop at Mejuri again.",Seattle,2.0,2/10/2024 0:00,Mejuri,5,"2621 NE University Village St, Seattle, WA",WA,Tanya Lee,Failed,,
"This is my new very favorite store. Since getting my ears pierced recently Ive purchased a lot of earrings here. Great quality, service and in-store experience. And their prices cant be beat anywhere. Seriously, for 14k gold, diamond jewelry, the prices are fantastic.Ive also had a couple of piercings done at this location and the experience was outstanding. Theyre helpful with picking out piercing jewelry and their piercing studio and hygiene practices are top-notch. I love their use of the needle over the gun.Great store!",Seattle,0.0,2/10/2024 0:00,Mejuri,5,"2621 NE University Village St, Seattle, WA",WA,Ray NW,Failed,,
Super positive piercing experience with Liv! Mejuri uses piercing professionals and that was definitely clear through my experience. Would highly recommend!,Seattle,0.0,5/10/2024 0:00,Mejuri,5,"2621 NE University Village St, Seattle, WA",WA,Allie,Failed,,
"Its great to be able to see all the jewelry in person, but the purchase experience is nonetheless suboptimal.First, there was a line outside of the store, which was fine because I only waited for 5 minutes.Second, its a little confusing on whether I should hold onto items that Im interested in my shopping basket. Every time when I ask an associate about the price, they always ask are you ready to check out?Last but not least, after I paid for my items, I waited for 10+ minutes for them to fetch the products from the back of the store...",Seattle,3.0,2/10/2023 0:00,Mejuri,3,"2621 NE University Village St, Seattle, WA",WA,K Min,Failed,,
"The last two times Ive gone into the store I am always greeted and asked what Im looking for and when I say Id just like to look around thats when service seems to go downhill. Im looking for nice hoop earrings, I have multiple pairs from mejuri and I was looking to get new ones (huggie hoops, dome or others) and whenever Im left to look on my own the staff start talking about people, no idea who they are talking about but the last time I was in there five employees were gossiping about someone and not really paying attention to people walking into the store or were not around to answer questions about the earrings. It felt uncomfortable to be there while listening to them talk, I will purchase online next time and dont really want to support this mejuri location.",Seattle,2.0,2/10/2024 0:00,Mejuri,1,"2621 NE University Village St, Seattle, WA",WA,Kimberley Campbell,Failed,,
"Had such a wonderful experience at the University Village Mejuri! I was looking to purchase the Tiny Pearl Necklace for my cousin for her birthday. The day I popped online to purchase the necklace, I saw it was backordered. I immediately called the U-Village location. They had the item in stock and offered to hold it for me! Such wonderful customer service. Turns out, my cousin had been eyeing this piece for a while, so it was the perfect surprise for her. Thank you to the Mejuri team for your great customer care. A+!!!",Seattle,0.0,2/10/2024 0:00,Mejuri,5,"2621 NE University Village St, Seattle, WA",WA,Hannah Winemiller,Failed,,
"The store is beautiful, and it is really nice to see all of the items that they have online in person.However, I didnt have the best experience with the setup towards ear piercing. First, I asked to be contacted when they had a piercer lined up (which the staff said they would do), and was never emailed. Then I signed up for an appointment online, and it was canceled because the piercers schedule wasnt updated online. When I finally got to my appointment, I was told I couldnt get my ears pierced because of a possible keloid scarring issue I may have had on one of my previous piercings although I was willing to take the risk. This was fair, but I feel like this could have been a part of the terms & conditions form I had to sign. Also, the piercer didnt want to do 4 piercings although the website allows up to four in one appointment. The whole thing ends with Mejuri sending me an email on aftercare for piercings that I never received.I feel like there were so many factors that resulted in a not-great in-person experience for me.",Seattle,8.0,2/10/2023 0:00,Mejuri,2,"2621 NE University Village St, Seattle, WA",WA,YeJi An,Failed,,
"Very kind and accommodating staff! Ive had to exchange jewelry there twice now & both times the person helping me was very kind and understanding, & very helpful in assisting me with finding new jewelry.",Seattle,0.0,4/10/2024 0:00,Mejuri,5,"2621 NE University Village St, Seattle, WA",WA,Sophia Reinhardt,Failed,,
"Im usually not too eager to give negative reviews, but the service here (or lack thereof) is just ridiculous. I understand the service industry is difficult and human beings have emotions, but simply ignoring customers to chat with coworkers isnt really a good thing to do, whatever the circumstance. I will never buy anything from mejuri again, and I will ensure neither do my friends or family.",Seattle,5.0,2/10/2024 0:00,Mejuri,1,"2621 NE University Village St, Seattle, WA",WA,Kevin Li,Failed,,
I always see ads of this business on Instagram and Facebook. Was nice to see the jewellery in person and allowed to try on with the alcohol wipes readily available near the displays. Staff was welcoming and available for help. I didnt buy anything as I couldnt make up my mind on what I wanted but just nice to see it finally in person. Lots of shoppers though when I went on a Monday afternoon.,Seattle,0.0,2/10/2024 0:00,Mejuri,4,"2621 NE University Village St, Seattle, WA",WA,Lisa,Failed,,
"I love shopping at Mejuri online, but when I was in Seattle visiting family it was nice to get to go in-store! I bought a pair of solid gold earrings and the sales associate were attentive and answered all my questions. Will definitely pop by whenever Im in Seattle next!",Seattle,3.0,2/10/2023 0:00,Mejuri,5,"2621 NE University Village St, Seattle, WA",WA,Ukwuoma Ukairo,Failed,,
Manager at University Village was rude and not customer friendly.Nobody told me that I cant return piercing earring. I just looked at website and found 30days return policy. I am really upset because I have been using this shop not first time .,Seattle,0.0,4/10/2024 0:00,Mejuri,1,"2621 NE University Village St, Seattle, WA",WA,An Vaa,Failed,,
Wow I had an incredible experience here! The sales associate Cecilia was patient and knowledgeable! She was such a pleasure to work with and I love what I bought!!!,Seattle,2.0,2/10/2024 0:00,Mejuri,5,"2621 NE University Village St, Seattle, WA",WA,Margeaux Green,Failed,,
Great customer service was amazing and I always end up getting something for me - which I love!,Seattle,0.0,2/10/2024 0:00,Mejuri,5,"2621 NE University Village St, Seattle, WA",WA,Evangeline Haak,Failed,,
Couldnt be more obsessed. Its exactly what you would imagine. Not only is the store so clean its also so classy and beautiful on the inside. I was looking for a gift for my mother and the staff was so welcoming and inviting and allowed me to browse while also giving me input. Couldnt be more impress. I found the most perfect gold hoops.  Cant wait to go back!!,Seattle,0.0,2/10/2024 0:00,Mejuri,5,"2621 NE University Village St, Seattle, WA",WA,Praise jorgenson,Failed,,
A lovely store. The jewelry advisors were very helpful and I enjoyed my experience there. I shall visit again soon. Reasonably priced jewelry selections.,Seattle,0.0,2/10/2024 0:00,Mejuri,5,"2621 NE University Village St, Seattle, WA",WA,Karyn Porter,Failed,,
I had a fantastic experience here while shopping for a birthday gift for my sister! The employee was very helpful and my sister loved the pearl hoop earrings I got her. Will be back!,Seattle,0.0,2/10/2024 0:00,Mejuri,5,"2621 NE University Village St, Seattle, WA",WA,Hanna Belcher,Failed,,
Love love love this store and website.  Exactly the what Im looking for and the right price.  Not too expensive but definitely the quality that I want.  Just purchased my 4th ring and couldnt be happier.,Seattle,0.0,2/10/2024 0:00,Mejuri,5,"2621 NE University Village St, Seattle, WA",WA,Tammy Wilson,Failed,,
I looooove the new Mejuri store! I had a great experience finding my mom a bracelet for her birthday and she loved it. Great prices and a lovely staff.,Seattle,1.0,2/10/2023 0:00,Mejuri,5,"2621 NE University Village St, Seattle, WA",WA,Brenton Swart,Failed,,
A must go if you are in Seattle! The staff were all very welcoming and answered any questions I had with ease. The earrings I got are absolutely perfect! ♥,Seattle,5.0,2/10/2023 0:00,Mejuri,5,"2621 NE University Village St, Seattle, WA",WA,Chris Shelley,Failed,,
Absolutely love this place. Got some of their jewelry as a graduation present and its amazing quality and looks exactly how it does online. Highly recommend!!!,Seattle,0.0,2/10/2024 0:00,Mejuri,5,"2621 NE University Village St, Seattle, WA",WA,Elizabeth,Failed,,
"Helped me find the malachite bracelet of my dreams! Stayed open late to ensure the purchase went through, wonderful customer service, will definitely be back many times!",Seattle,5.0,2/10/2023 0:00,Mejuri,5,"2621 NE University Village St, Seattle, WA",WA,Jake Hambacher,Failed,,
I am highly impressed with the overall experience at Mejuri especially piercing done by their artist.,Seattle,0.0,3/10/2024 0:00,Mejuri,5,"2621 NE University Village St, Seattle, WA",WA,Ashvini Fulpagar,Failed,,
"The selection here is good and a majority of the employees are friendly. Unfortunately, one of the managers was very unkind and talked down to me. While I love the product, I am put off from returning to this location.",Seattle,6.0,2/10/2023 0:00,Mejuri,1,"2621 NE University Village St, Seattle, WA",WA,Nikki Kenyon,Failed,,
The UV Team is very helpful and Im looking forward to coming back to do some more shopping!,Seattle,0.0,2/10/2024 0:00,Mejuri,5,"2621 NE University Village St, Seattle, WA",WA,Hattie Mcmann,Failed,,
Beautiful little showcase. Love how you can try on items and its extremely clean in here. The jewelry selection is beautiful,Seattle,0.0,2/10/2024 0:00,Mejuri,5,"2621 NE University Village St, Seattle, WA",WA,AV Goodsell,Failed,,
"It was great, easy and no one following me asking questions. I would buy again anytime",Seattle,0.0,3/10/2024 0:00,Mejuri,5,"2621 NE University Village St, Seattle, WA",WA,Bela Paris,Failed,,
"Shopped here for a gift and had a great experience, the person working was so nice and helpful!",Seattle,0.0,2/10/2024 0:00,Mejuri,5,"2621 NE University Village St, Seattle, WA",WA,Gwen M,Failed,,
Really pleased with my stylist. Very helpful and professional!,Seattle,0.0,2/10/2024 0:00,Mejuri,5,"2621 NE University Village St, Seattle, WA",WA,Kris Holz,Failed,,
"Beautiful, very well-made jewelry",Seattle,0.0,4/10/2024 0:00,Mejuri,5,"2621 NE University Village St, Seattle, WA",WA,Becky Allen,Failed,,
Love Love Love the Bubble ring and the Puffy charlotte!,Seattle,0.0,5/10/2024 0:00,Mejuri,5,"2621 NE University Village St, Seattle, WA",WA,Camille Colaizzo,Failed,,
Two stars only for how cute the product is.Everything else was bad bad bad.,Seattle,1.0,2/10/2024 0:00,Mejuri,2,"2621 NE University Village St, Seattle, WA",WA,Uncle Bacon Face,Failed,,
Awful customer service from manager Alex!,Seattle,0.0,7/10/2024 0:00,Mejuri,1,"2621 NE University Village St, Seattle, WA",WA,Dan Fowler,Failed,,
Drove all the way there with 15 minutes until close and they didnt let us in. Disappointing.,Seattle,7.0,2/10/2023 0:00,Mejuri,1,"2621 NE University Village St, Seattle, WA",WA,Alex Honeywell,Failed,,
